id,inputs,reference_outputs,session_name,repetition,outputs,run,status,error,latency,tokens,total_cost,clarity,f1_score,precision
9a3d9e28-ae02-427b-8e23-8cd30642fe7b,"{""bug_report"": ""No iOS, ao girar o celular para landscape, o layout da tela de perfil fica quebrado.""}","{""reference"": ""Como um usuário de iOS, eu quero visualizar minha tela de perfil em modo paisagem, para que eu possa usar o app em qualquer orientação sem problemas visuais.\n\nCritérios de Aceitação:\n- Dado que estou na tela de perfil no iOS\n- Quando giro o dispositivo para modo paisagem\n- Então o layout deve se adaptar corretamente\n- E todos os elementos devem permanecer visíveis e alinhados\n- E não deve haver sobreposição de componentes""}",msartor-bug_to_user_story_v2-548fe51e,1,"{""answer"": ""## User Story\n\n**Como** usuário do aplicativo iOS,\n**Eu quero** visualizar meu perfil de forma consistente e sem distorções,\n**Para que** eu possa acessar minhas informações claramente, independentemente da orientação do meu dispositivo, e ter uma experiência de uso fluida e profissional.\n\n---\n\n## Critérios de Aceitação\n\n**Cenário 1: Layout do perfil em modo retrato (Portrait)**\n- **Dado que** estou na tela de perfil do aplicativo iOS\n- **Quando** meu dispositivo está na orientação retrato\n- **Então** o layout da tela de perfil deve ser exibido corretamente\n- **E** todos os elementos (texto, imagens, botões) devem estar alinhados, visíveis e sem sobreposições\n\n**Cenário 2: Layout do perfil em modo paisagem (Landscape)**\n- **Dado que** estou na tela de perfil do aplicativo iOS\n- **Quando** giro meu dispositivo para a orientação paisagem\n- **Então** o layout da tela de perfil deve se adaptar corretamente à nova orientação\n- **E** todos os elementos devem permanecer visíveis, alinhados e sem sobreposições\n- **E** não deve haver elementos cortados ou fora da área visível da tela\n\n**Cenário 3: Retorno ao modo retrato (Portrait)**\n- **Dado que** estou na tela de perfil do aplicativo iOS em orientação paisagem com o layout correto\n- **Quando** giro meu dispositivo de volta para a orientação retrato\n- **Então** o layout da tela de perfil deve retornar à sua exibição correta para o modo retrato\n- **E** todos os elementos devem estar alinhados e visíveis, sem resquícios ou distorções do layout paisagem\n\n---\n\n## Contexto Técnico\n- **Plataforma afetada**: iOS\n- **Tela afetada**: Tela de perfil\n- **Causa raiz provável**: Problemas com as constraints de Auto Layout (UIKit) ou modificadores de layout (SwiftUI) que não se adaptam corretamente às mudanças de orientação (size class changes).\n- **Sugestão de correção**: Revisar e ajustar as constraints de Auto Layout ou os modificadores de layout da tela de perfil para garantir que os elementos se redimensionem e reposicionem adequadamente em ambas as orientações (portrait e landscape).\n\n## Notas Adicionais\n- **Prioridade**: Média — afeta a usabilidade e a percepção de qualidade do aplicativo, mas não impede a funcionalidade principal.\n- **Abrangência**: Verificar se o problema é isolado à tela de perfil ou se outras telas também apresentam comportamento similar ao girar o dispositivo.\n- **Testes**: Testar em diferentes modelos de iPhone/iPad e versões do iOS para garantir a correção em diversos cenários.""}","{""inputs"": {""inputs"": {""bug_report"": ""No iOS, ao girar o celular para landscape, o layout da tela de perfil fica quebrado.""}}, ""outputs"": {""answer"": ""## User Story\n\n**Como** usuário do aplicativo iOS,\n**Eu quero** visualizar meu perfil de forma consistente e sem distorções,\n**Para que** eu possa acessar minhas informações claramente, independentemente da orientação do meu dispositivo, e ter uma experiência de uso fluida e profissional.\n\n---\n\n## Critérios de Aceitação\n\n**Cenário 1: Layout do perfil em modo retrato (Portrait)**\n- **Dado que** estou na tela de perfil do aplicativo iOS\n- **Quando** meu dispositivo está na orientação retrato\n- **Então** o layout da tela de perfil deve ser exibido corretamente\n- **E** todos os elementos (texto, imagens, botões) devem estar alinhados, visíveis e sem sobreposições\n\n**Cenário 2: Layout do perfil em modo paisagem (Landscape)**\n- **Dado que** estou na tela de perfil do aplicativo iOS\n- **Quando** giro meu dispositivo para a orientação paisagem\n- **Então** o layout da tela de perfil deve se adaptar corretamente à nova orientação\n- **E** todos os elementos devem permanecer visíveis, alinhados e sem sobreposições\n- **E** não deve haver elementos cortados ou fora da área visível da tela\n\n**Cenário 3: Retorno ao modo retrato (Portrait)**\n- **Dado que** estou na tela de perfil do aplicativo iOS em orientação paisagem com o layout correto\n- **Quando** giro meu dispositivo de volta para a orientação retrato\n- **Então** o layout da tela de perfil deve retornar à sua exibição correta para o modo retrato\n- **E** todos os elementos devem estar alinhados e visíveis, sem resquícios ou distorções do layout paisagem\n\n---\n\n## Contexto Técnico\n- **Plataforma afetada**: iOS\n- **Tela afetada**: Tela de perfil\n- **Causa raiz provável**: Problemas com as constraints de Auto Layout (UIKit) ou modificadores de layout (SwiftUI) que não se adaptam corretamente às mudanças de orientação (size class changes).\n- **Sugestão de correção**: Revisar e ajustar as constraints de Auto Layout ou os modificadores de layout da tela de perfil para garantir que os elementos se redimensionem e reposicionem adequadamente em ambas as orientações (portrait e landscape).\n\n## Notas Adicionais\n- **Prioridade**: Média — afeta a usabilidade e a percepção de qualidade do aplicativo, mas não impede a funcionalidade principal.\n- **Abrangência**: Verificar se o problema é isolado à tela de perfil ou se outras telas também apresentam comportamento similar ao girar o dispositivo.\n- **Testes**: Testar em diferentes modelos de iPhone/iPad e versões do iOS para garantir a correção em diversos cenários.""}, ""session_id"": ""6b043d0d-0b39-4ac0-bdb0-21c3c621466d"", ""error"": null, ""extra"": {""metadata"": {""LANGSMITH_ENDPOINT"": ""https://api.smith.langchain.com"", ""LANGSMITH_PROJECT"": ""bug-to-user-story"", ""LANGSMITH_TRACING"": ""true"", ""example_version"": ""2026-05-05T23:50:28.701326+00:00"", ""ls_example_dataset_split"": [""base""], ""ls_method"": ""traceable"", ""ls_run_depth"": 0, ""model"": ""gemini-2.5-flash"", ""num_repetitions"": 1, ""prompt_name"": ""msartor/bug_to_user_story_v2"", ""provider"": ""google"", ""revision_id"": null}, ""runtime"": {""langchain_core_version"": ""0.3.28"", ""langchain_version"": ""0.3.13"", ""library"": ""langsmith"", ""platform"": ""Linux-6.8.0-110-generic-x86_64-with-glibc2.39"", ""py_implementation"": ""CPython"", ""runtime"": ""python"", ""runtime_version"": ""3.12.2"", ""sdk"": ""langsmith-py"", ""sdk_version"": ""0.2.7""}}, ""run_type"": ""chain"", ""id"": ""559f15b4-1f0c-4916-95ec-4368a1a0f68a"", ""status"": ""success""}",success,,9.386518001556396,5069,0.0024155,0.93,1.0,1.0
9c61b44c-d972-4184-94e6-8cd7b279652d,"{""bug_report"": ""Webhook de pagamento aprovado não está sendo chamado.\n\nSteps to reproduce:\n1. Fazer pedido de R$ 100\n2. Pagar com cartão de crédito\n3. Pagamento é aprovado no gateway\n4. Sistema não recebe notificação\n5. Status do pedido fica como \""pendente\""\n\nLogs do gateway mostram: HTTP 500 ao tentar POST /api/webhooks/payment""}","{""reference"": ""Como o sistema de e-commerce, eu quero receber notificações de pagamento aprovado via webhook, para que o status dos pedidos seja atualizado automaticamente após confirmação do pagamento.\n\nCritérios de Aceitação:\n- Dado que um pagamento é aprovado no gateway\n- Quando o gateway envia POST para /api/webhooks/payment\n- Então o endpoint deve retornar HTTP 200\n- E o status do pedido deve mudar de \""pendente\"" para \""aprovado\""\n- E o cliente deve receber email de confirmação\n- E o sistema deve logar o evento para auditoria\n\nContexto Técnico:\n- Endpoint está retornando HTTP 500\n- Gateway: [nome do gateway de pagamento]\n- Logs indicam falha no processamento do webhook""}",msartor-bug_to_user_story_v2-548fe51e,1,"{""answer"": ""## User Story\n\n**Como** Gerente de Operações,\n**Eu quero** que o status dos pedidos seja atualizado automaticamente para \""aprovado\"" após a confirmação do pagamento pelo gateway,\n**Para que** possamos processar e enviar os pedidos de forma eficiente, sem atrasos ou necessidade de intervenção manual.\n\n---\n\n## Critérios de Aceitação\n\n**Cenário 1: Notificação de pagamento aprovado recebida e processada com sucesso**\n- **Dado que** um cliente fez um pedido de R$ 100\n- **E** o pagamento foi aprovado com sucesso no gateway de pagamento\n- **Quando** o gateway tenta enviar a notificação para `POST /api/webhooks/payment`\n- **Então** o sistema deve receber e processar a notificação com sucesso (retornando HTTP 200/204 para o gateway)\n- **E** o status do pedido deve ser atualizado automaticamente de \""pendente\"" para \""aprovado\""\n\n**Cenário 2: Tratamento de falha na notificação do webhook**\n- **Dado que** um pagamento foi aprovado no gateway\n- **E** o gateway tenta enviar a notificação para `POST /api/webhooks/payment`\n- **E** o endpoint retorna um erro `HTTP 500`\n- **Quando** o sistema tenta processar a notificação\n- **Então** o gateway deve tentar reenviar a notificação (mecanismo de retry)\n- **E** o sistema deve registrar o erro detalhadamente nos logs para investigação\n\n**Cenário 3: Idempotência da notificação de pagamento**\n- **Dado que** uma notificação de pagamento aprovado para um pedido específico já foi processada com sucesso\n- **Quando** o gateway envia a mesma notificação novamente para `POST /api/webhooks/payment` (ex: por um retry ou falha de rede anterior)\n- **Então** o sistema deve processar a notificação sem duplicar o status ou causar efeitos colaterais indesejados\n- **E** o status do pedido deve permanecer \""aprovado\""\n\n**Cenário 4: Alerta para falhas persistentes do webhook**\n- **Dado que** o endpoint `POST /api/webhooks/payment` retorna `HTTP 500` por mais de 5 tentativas consecutivas para diferentes pagamentos\n- **Quando** novas notificações de pagamento aprovado chegam\n- **Então** o sistema deve gerar um alerta para o time de desenvolvimento/operações\n- **E** o status dos pedidos afetados deve ser marcado como \""pendente com erro\"" para revisão manual\n\n---\n\n## Contexto Técnico\n- **Causa raiz identificada**: O endpoint `POST /api/webhooks/payment` está retornando `HTTP 500` quando o gateway de pagamento tenta enviar a notificação de pagamento aprovado.\n- **Impacto**: Pedidos ficam com status \""pendente\"", exigindo intervenção manual da equipe de operações e atrasando o processamento e envio.\n- **Endpoint afetado**: `POST /api/webhooks/payment`\n- **Solução proposta**:\n    1.  Investigar a causa exata do `HTTP 500` no endpoint `POST /api/webhooks/payment` (ex: erro de lógica, dependência externa, estouro de memória).\n    2.  Implementar uma fila de processamento assíncrono para webhooks, para que falhas temporárias não bloqueiem o recebimento e permitam retries controlados e visibilidade.\n    3.  Garantir que o endpoint retorne um status `HTTP 200 OK` ou `HTTP 204 No Content` para o gateway após o recebimento bem-sucedido da notificação.\n    4.  Monitorar o endpoint com ferramentas de APM (Application Performance Monitoring) para identificar a causa do erro e prevenir futuras ocorrências.\n\n## Notas Adicionais\n- **Prioridade**: Alta — Impacta diretamente a operação, a satisfação do cliente e pode levar a perdas de receita se os pedidos não forem processados.\n- Verificar se o gateway de pagamento possui um mecanismo de retry configurado e qual o comportamento esperado em caso de falha persistente do webhook.""}","{""inputs"": {""inputs"": {""bug_report"": ""Webhook de pagamento aprovado não está sendo chamado.\n\nSteps to reproduce:\n1. Fazer pedido de R$ 100\n2. Pagar com cartão de crédito\n3. Pagamento é aprovado no gateway\n4. Sistema não recebe notificação\n5. Status do pedido fica como \""pendente\""\n\nLogs do gateway mostram: HTTP 500 ao tentar POST /api/webhooks/payment""}}, ""outputs"": {""answer"": ""## User Story\n\n**Como** Gerente de Operações,\n**Eu quero** que o status dos pedidos seja atualizado automaticamente para \""aprovado\"" após a confirmação do pagamento pelo gateway,\n**Para que** possamos processar e enviar os pedidos de forma eficiente, sem atrasos ou necessidade de intervenção manual.\n\n---\n\n## Critérios de Aceitação\n\n**Cenário 1: Notificação de pagamento aprovado recebida e processada com sucesso**\n- **Dado que** um cliente fez um pedido de R$ 100\n- **E** o pagamento foi aprovado com sucesso no gateway de pagamento\n- **Quando** o gateway tenta enviar a notificação para `POST /api/webhooks/payment`\n- **Então** o sistema deve receber e processar a notificação com sucesso (retornando HTTP 200/204 para o gateway)\n- **E** o status do pedido deve ser atualizado automaticamente de \""pendente\"" para \""aprovado\""\n\n**Cenário 2: Tratamento de falha na notificação do webhook**\n- **Dado que** um pagamento foi aprovado no gateway\n- **E** o gateway tenta enviar a notificação para `POST /api/webhooks/payment`\n- **E** o endpoint retorna um erro `HTTP 500`\n- **Quando** o sistema tenta processar a notificação\n- **Então** o gateway deve tentar reenviar a notificação (mecanismo de retry)\n- **E** o sistema deve registrar o erro detalhadamente nos logs para investigação\n\n**Cenário 3: Idempotência da notificação de pagamento**\n- **Dado que** uma notificação de pagamento aprovado para um pedido específico já foi processada com sucesso\n- **Quando** o gateway envia a mesma notificação novamente para `POST /api/webhooks/payment` (ex: por um retry ou falha de rede anterior)\n- **Então** o sistema deve processar a notificação sem duplicar o status ou causar efeitos colaterais indesejados\n- **E** o status do pedido deve permanecer \""aprovado\""\n\n**Cenário 4: Alerta para falhas persistentes do webhook**\n- **Dado que** o endpoint `POST /api/webhooks/payment` retorna `HTTP 500` por mais de 5 tentativas consecutivas para diferentes pagamentos\n- **Quando** novas notificações de pagamento aprovado chegam\n- **Então** o sistema deve gerar um alerta para o time de desenvolvimento/operações\n- **E** o status dos pedidos afetados deve ser marcado como \""pendente com erro\"" para revisão manual\n\n---\n\n## Contexto Técnico\n- **Causa raiz identificada**: O endpoint `POST /api/webhooks/payment` está retornando `HTTP 500` quando o gateway de pagamento tenta enviar a notificação de pagamento aprovado.\n- **Impacto**: Pedidos ficam com status \""pendente\"", exigindo intervenção manual da equipe de operações e atrasando o processamento e envio.\n- **Endpoint afetado**: `POST /api/webhooks/payment`\n- **Solução proposta**:\n    1.  Investigar a causa exata do `HTTP 500` no endpoint `POST /api/webhooks/payment` (ex: erro de lógica, dependência externa, estouro de memória).\n    2.  Implementar uma fila de processamento assíncrono para webhooks, para que falhas temporárias não bloqueiem o recebimento e permitam retries controlados e visibilidade.\n    3.  Garantir que o endpoint retorne um status `HTTP 200 OK` ou `HTTP 204 No Content` para o gateway após o recebimento bem-sucedido da notificação.\n    4.  Monitorar o endpoint com ferramentas de APM (Application Performance Monitoring) para identificar a causa do erro e prevenir futuras ocorrências.\n\n## Notas Adicionais\n- **Prioridade**: Alta — Impacta diretamente a operação, a satisfação do cliente e pode levar a perdas de receita se os pedidos não forem processados.\n- Verificar se o gateway de pagamento possui um mecanismo de retry configurado e qual o comportamento esperado em caso de falha persistente do webhook.""}, ""session_id"": ""6b043d0d-0b39-4ac0-bdb0-21c3c621466d"", ""error"": null, ""extra"": {""metadata"": {""LANGSMITH_ENDPOINT"": ""https://api.smith.langchain.com"", ""LANGSMITH_PROJECT"": ""bug-to-user-story"", ""LANGSMITH_TRACING"": ""true"", ""example_version"": ""2026-05-05T23:50:29.267347+00:00"", ""ls_example_dataset_split"": [""base""], ""ls_method"": ""traceable"", ""ls_run_depth"": 0, ""model"": ""gemini-2.5-flash"", ""num_repetitions"": 1, ""prompt_name"": ""msartor/bug_to_user_story_v2"", ""provider"": ""google"", ""revision_id"": null}, ""runtime"": {""langchain_core_version"": ""0.3.28"", ""langchain_version"": ""0.3.13"", ""library"": ""langsmith"", ""platform"": ""Linux-6.8.0-110-generic-x86_64-with-glibc2.39"", ""py_implementation"": ""CPython"", ""runtime"": ""python"", ""runtime_version"": ""3.12.2"", ""sdk"": ""langsmith-py"", ""sdk_version"": ""0.2.7""}}, ""run_type"": ""chain"", ""id"": ""7ed47660-a57a-4286-a1cb-f3a4a548dce9"", ""status"": ""success""}",success,,13.765523910522461,6086,0.0032884,1.0,0.8571,1.0
9e03658b-6bfa-4fc8-9f29-7de71a94b101,"{""bug_report"": ""Campo de email aceita texto sem @, permitindo cadastros inválidos.""}","{""reference"": ""Como um usuário criando uma conta, eu quero que o sistema valide meu email corretamente, para que eu não insira um endereço inválido por engano.\n\nCritérios de Aceitação:\n- Dado que estou no formulário de cadastro\n- Quando digito um email sem o caractere @\n- Então devo ver uma mensagem de erro\n- E não devo conseguir prosseguir com o cadastro\n- E a mensagem deve explicar o formato correto""}",msartor-bug_to_user_story_v2-548fe51e,1,"{""answer"": ""## User Story\n\n**Como** novo usuário,\n**Eu quero** que o campo de e-mail valide o formato correto ao me cadastrar,\n**Para que** eu possa ter certeza de que meu e-mail é válido, receber comunicações importantes do sistema e acessar minha conta sem problemas.\n\n---\n\n## Critérios de Aceitação\n\n**Cenário 1: Tentativa de cadastro com e-mail inválido (sem '@')**\n- **Dado que** estou na tela de cadastro\n- **Quando** digito \""meuemaildominio.com\"" (sem o caractere '@') no campo de e-mail\n- **E** tento prosseguir com o cadastro\n- **Então** o sistema deve exibir uma mensagem de erro clara, como \""Por favor, insira um e-mail válido\""\n- **E** não devo conseguir finalizar o cadastro\n\n**Cenário 2: Cadastro com e-mail válido**\n- **Dado que** estou na tela de cadastro\n- **Quando** digito \""meuemail@dominio.com\"" no campo de e-mail\n- **E** preencho os demais campos obrigatórios corretamente\n- **E** tento prosseguir com o cadastro\n- **Então** o sistema deve aceitar o e-mail\n- **E** devo conseguir finalizar o cadastro com sucesso\n\n**Cenário 3: Tentativa de cadastro com e-mail vazio**\n- **Dado que** estou na tela de cadastro\n- **Quando** deixo o campo de e-mail vazio\n- **E** tento prosseguir com o cadastro\n- **Então** o sistema deve exibir uma mensagem de erro informando que o campo de e-mail é obrigatório\n- **E** não devo conseguir finalizar o cadastro\n\n**Cenário 4: Validação de e-mail com múltiplos pontos e subdomínios**\n- **Dado que** estou na tela de cadastro\n- **Quando** digito \""nome.sobrenome@sub.dominio.com.br\"" no campo de e-mail\n- **E** preencho os demais campos obrigatórios corretamente\n- **E** tento prosseguir com o cadastro\n- **Então** o sistema deve aceitar o e-mail\n- **E** devo conseguir finalizar o cadastro com sucesso\n\n---\n\n## Contexto Técnico\n- **Causa raiz**: Ausência ou falha na validação de formato de e-mail no front-end e/ou back-end.\n- **Solução proposta**: Implementar validação de expressão regular (regex) para o formato de e-mail.\n- **Recomendação**: A validação deve ser feita tanto no lado do cliente (para feedback imediato ao usuário) quanto no lado do servidor (para garantir a integridade dos dados e segurança, evitando que dados inválidos sejam persistidos).\n- **Exemplo de regex (pode variar)**: `^[a-zA-Z0-9._%+-]+@[a-zA-Z0-9.-]+\\.[a-zA-Z]{2,}$`\n\n## Notas Adicionais\n- **Prioridade**: Média/Alta — Impacta a qualidade dos dados do usuário, a capacidade de comunicação do sistema (e-mails de marketing, recuperação de senha) e a experiência do usuário.\n- **Impacto**: Pode levar a e-mails inválidos na base de dados, aumentando a taxa de bounce de e-mails e dificultando a comunicação com os usuários.""}","{""inputs"": {""inputs"": {""bug_report"": ""Campo de email aceita texto sem @, permitindo cadastros inválidos.""}}, ""outputs"": {""answer"": ""## User Story\n\n**Como** novo usuário,\n**Eu quero** que o campo de e-mail valide o formato correto ao me cadastrar,\n**Para que** eu possa ter certeza de que meu e-mail é válido, receber comunicações importantes do sistema e acessar minha conta sem problemas.\n\n---\n\n## Critérios de Aceitação\n\n**Cenário 1: Tentativa de cadastro com e-mail inválido (sem '@')**\n- **Dado que** estou na tela de cadastro\n- **Quando** digito \""meuemaildominio.com\"" (sem o caractere '@') no campo de e-mail\n- **E** tento prosseguir com o cadastro\n- **Então** o sistema deve exibir uma mensagem de erro clara, como \""Por favor, insira um e-mail válido\""\n- **E** não devo conseguir finalizar o cadastro\n\n**Cenário 2: Cadastro com e-mail válido**\n- **Dado que** estou na tela de cadastro\n- **Quando** digito \""meuemail@dominio.com\"" no campo de e-mail\n- **E** preencho os demais campos obrigatórios corretamente\n- **E** tento prosseguir com o cadastro\n- **Então** o sistema deve aceitar o e-mail\n- **E** devo conseguir finalizar o cadastro com sucesso\n\n**Cenário 3: Tentativa de cadastro com e-mail vazio**\n- **Dado que** estou na tela de cadastro\n- **Quando** deixo o campo de e-mail vazio\n- **E** tento prosseguir com o cadastro\n- **Então** o sistema deve exibir uma mensagem de erro informando que o campo de e-mail é obrigatório\n- **E** não devo conseguir finalizar o cadastro\n\n**Cenário 4: Validação de e-mail com múltiplos pontos e subdomínios**\n- **Dado que** estou na tela de cadastro\n- **Quando** digito \""nome.sobrenome@sub.dominio.com.br\"" no campo de e-mail\n- **E** preencho os demais campos obrigatórios corretamente\n- **E** tento prosseguir com o cadastro\n- **Então** o sistema deve aceitar o e-mail\n- **E** devo conseguir finalizar o cadastro com sucesso\n\n---\n\n## Contexto Técnico\n- **Causa raiz**: Ausência ou falha na validação de formato de e-mail no front-end e/ou back-end.\n- **Solução proposta**: Implementar validação de expressão regular (regex) para o formato de e-mail.\n- **Recomendação**: A validação deve ser feita tanto no lado do cliente (para feedback imediato ao usuário) quanto no lado do servidor (para garantir a integridade dos dados e segurança, evitando que dados inválidos sejam persistidos).\n- **Exemplo de regex (pode variar)**: `^[a-zA-Z0-9._%+-]+@[a-zA-Z0-9.-]+\\.[a-zA-Z]{2,}$`\n\n## Notas Adicionais\n- **Prioridade**: Média/Alta — Impacta a qualidade dos dados do usuário, a capacidade de comunicação do sistema (e-mails de marketing, recuperação de senha) e a experiência do usuário.\n- **Impacto**: Pode levar a e-mails inválidos na base de dados, aumentando a taxa de bounce de e-mails e dificultando a comunicação com os usuários.""}, ""session_id"": ""6b043d0d-0b39-4ac0-bdb0-21c3c621466d"", ""error"": null, ""extra"": {""metadata"": {""LANGSMITH_ENDPOINT"": ""https://api.smith.langchain.com"", ""LANGSMITH_PROJECT"": ""bug-to-user-story"", ""LANGSMITH_TRACING"": ""true"", ""example_version"": ""2026-05-05T23:50:28.511232+00:00"", ""ls_example_dataset_split"": [""base""], ""ls_method"": ""traceable"", ""ls_run_depth"": 0, ""model"": ""gemini-2.5-flash"", ""num_repetitions"": 1, ""prompt_name"": ""msartor/bug_to_user_story_v2"", ""provider"": ""google"", ""revision_id"": null}, ""runtime"": {""langchain_core_version"": ""0.3.28"", ""langchain_version"": ""0.3.13"", ""library"": ""langsmith"", ""platform"": ""Linux-6.8.0-110-generic-x86_64-with-glibc2.39"", ""py_implementation"": ""CPython"", ""runtime"": ""python"", ""runtime_version"": ""3.12.2"", ""sdk"": ""langsmith-py"", ""sdk_version"": ""0.2.7""}}, ""run_type"": ""chain"", ""id"": ""975407af-6222-4943-962b-27e7d2c47eda"", ""status"": ""success""}",success,,10.669787883758545,5376,0.0027965,0.98,0.8889,0.9
