id,inputs,reference_outputs,session_name,repetition,outputs,run,status,error,latency,tokens,total_cost,clarity,f1_score,precision
0873b0ec-ffcf-4817-ac90-d5f8ae32e2f2,"{""bug_report"": ""Pipeline de vendas calcula valor total errado quando há desconto.\n\nCenário:\n- Produto A: R$ 1.000\n- Produto B: R$ 500\n- Desconto: 10%\n- Valor esperado: R$ 1.350\n- Valor mostrado: R$ 1.400\n\nO sistema aplica desconto só no primeiro produto.""}","{""reference"": ""Como um vendedor gerenciando oportunidades no pipeline, eu quero que o valor total seja calculado corretamente quando aplico descontos, para que eu possa apresentar propostas precisas aos clientes.\n\nCritérios de Aceitação:\n- Dado que tenho uma oportunidade com múltiplos produtos\n- Quando aplico um desconto percentual\n- Então o desconto deve ser aplicado no valor total de todos os produtos\n- E o valor final deve ser: (soma dos produtos) × (1 - desconto%)\n- E o detalhamento deve mostrar: subtotal, desconto e total\n\nExemplo de Cálculo:\n- Produto A: R$ 1.000\n- Produto B: R$ 500\n- Subtotal: R$ 1.500\n- Desconto 10%: -R$ 150\n- Total: R$ 1.350\n\nContexto Técnico:\n- Bug atual: desconto sendo aplicado apenas no primeiro produto\n- Resultado incorreto: R$ 1.400 (deveria ser R$ 1.350)""}",msartor-bug_to_user_story_v2-548fe51e,1,"{""answer"": ""## User Story\n\n**Como** vendedor utilizando o pipeline de vendas,\n**Eu quero** que o sistema calcule o valor total da proposta corretamente, aplicando o desconto sobre o valor total de todos os produtos,\n**Para que** eu possa gerar propostas precisas, fechar vendas com confiança e evitar erros financeiros para a empresa e o cliente.\n\n---\n\n## Critérios de Aceitação\n\n**Cenário 1: Cálculo de desconto correto para múltiplos produtos**\n- **Dado que** tenho um pipeline de vendas com os seguintes produtos:\n    - Produto A: R$ 1.000\n    - Produto B: R$ 500\n- **E** um desconto de 10% é aplicado à venda\n- **Quando** visualizo o valor total da proposta\n- **Então** o valor total deve ser R$ 1.350\n- **E** não R$ 1.400 (que seria o resultado de aplicar o desconto apenas no Produto A e somar o Produto B: (1000 * 0.9) + 500 = 900 + 500 = 1400)\n\n**Cenário 2: Consistência do cálculo com diferentes quantidades de produtos**\n- **Dado que** tenho um pipeline de vendas com 2 unidades do Produto A (R$ 1.000 cada) e 1 unidade do Produto B (R$ 500)\n- **E** um desconto de 10% é aplicado à venda\n- **Quando** visualizo o valor total da proposta\n- **Então** o valor total deve ser R$ 2.250 (Subtotal: (2 * 1000) + 500 = 2500; Desconto: 2500 * 0.10 = 250; Total: 2500 - 250 = 2250)\n\n**Cenário 3: Detalhamento do cálculo visível na proposta**\n- **Dado que** tenho um pipeline de vendas com múltiplos produtos e um desconto aplicado\n- **Quando** visualizo o resumo da proposta\n- **Então** devo ver o subtotal dos produtos (antes do desconto)\n- **E** devo ver o valor do desconto aplicado separadamente\n- **E** devo ver o valor total final (subtotal - desconto)\n\n**Cenário 4: Cálculo correto sem aplicação de desconto**\n- **Dado que** tenho um pipeline de vendas com os seguintes produtos:\n    - Produto A: R$ 1.000\n    - Produto B: R$ 500\n- **E** nenhum desconto é aplicado à venda\n- **Quando** visualizo o valor total da proposta\n- **Então** o valor total deve ser R$ 1.500\n\n---\n\n## Contexto Técnico\n- **Causa raiz**: A lógica de aplicação do desconto está incorreta, aplicando o percentual apenas sobre o primeiro item ou um subtotal parcial, em vez de sobre o subtotal geral de todos os produtos.\n- **Impacto**: Erros financeiros nas propostas de vendas, perda de credibilidade com clientes e retrabalho para a equipe de vendas.\n- **Solução**: Revisar a função de cálculo de desconto para garantir que seja aplicada sobre o *subtotal geral* de todos os itens da venda antes de exibir o valor total.\n\n## Notas Adicionais\n- **Prioridade**: Alta — Impacta diretamente a precisão das propostas de vendas e a confiança do cliente.\n- Sugestão de implementação: Validar a função de cálculo de desconto em diferentes cenários (múltiplos produtos, diferentes percentuais, desconto zero) para garantir robustez.""}","{""inputs"": {""inputs"": {""bug_report"": ""Pipeline de vendas calcula valor total errado quando há desconto.\n\nCenário:\n- Produto A: R$ 1.000\n- Produto B: R$ 500\n- Desconto: 10%\n- Valor esperado: R$ 1.350\n- Valor mostrado: R$ 1.400\n\nO sistema aplica desconto só no primeiro produto.""}}, ""outputs"": {""answer"": ""## User Story\n\n**Como** vendedor utilizando o pipeline de vendas,\n**Eu quero** que o sistema calcule o valor total da proposta corretamente, aplicando o desconto sobre o valor total de todos os produtos,\n**Para que** eu possa gerar propostas precisas, fechar vendas com confiança e evitar erros financeiros para a empresa e o cliente.\n\n---\n\n## Critérios de Aceitação\n\n**Cenário 1: Cálculo de desconto correto para múltiplos produtos**\n- **Dado que** tenho um pipeline de vendas com os seguintes produtos:\n    - Produto A: R$ 1.000\n    - Produto B: R$ 500\n- **E** um desconto de 10% é aplicado à venda\n- **Quando** visualizo o valor total da proposta\n- **Então** o valor total deve ser R$ 1.350\n- **E** não R$ 1.400 (que seria o resultado de aplicar o desconto apenas no Produto A e somar o Produto B: (1000 * 0.9) + 500 = 900 + 500 = 1400)\n\n**Cenário 2: Consistência do cálculo com diferentes quantidades de produtos**\n- **Dado que** tenho um pipeline de vendas com 2 unidades do Produto A (R$ 1.000 cada) e 1 unidade do Produto B (R$ 500)\n- **E** um desconto de 10% é aplicado à venda\n- **Quando** visualizo o valor total da proposta\n- **Então** o valor total deve ser R$ 2.250 (Subtotal: (2 * 1000) + 500 = 2500; Desconto: 2500 * 0.10 = 250; Total: 2500 - 250 = 2250)\n\n**Cenário 3: Detalhamento do cálculo visível na proposta**\n- **Dado que** tenho um pipeline de vendas com múltiplos produtos e um desconto aplicado\n- **Quando** visualizo o resumo da proposta\n- **Então** devo ver o subtotal dos produtos (antes do desconto)\n- **E** devo ver o valor do desconto aplicado separadamente\n- **E** devo ver o valor total final (subtotal - desconto)\n\n**Cenário 4: Cálculo correto sem aplicação de desconto**\n- **Dado que** tenho um pipeline de vendas com os seguintes produtos:\n    - Produto A: R$ 1.000\n    - Produto B: R$ 500\n- **E** nenhum desconto é aplicado à venda\n- **Quando** visualizo o valor total da proposta\n- **Então** o valor total deve ser R$ 1.500\n\n---\n\n## Contexto Técnico\n- **Causa raiz**: A lógica de aplicação do desconto está incorreta, aplicando o percentual apenas sobre o primeiro item ou um subtotal parcial, em vez de sobre o subtotal geral de todos os produtos.\n- **Impacto**: Erros financeiros nas propostas de vendas, perda de credibilidade com clientes e retrabalho para a equipe de vendas.\n- **Solução**: Revisar a função de cálculo de desconto para garantir que seja aplicada sobre o *subtotal geral* de todos os itens da venda antes de exibir o valor total.\n\n## Notas Adicionais\n- **Prioridade**: Alta — Impacta diretamente a precisão das propostas de vendas e a confiança do cliente.\n- Sugestão de implementação: Validar a função de cálculo de desconto em diferentes cenários (múltiplos produtos, diferentes percentuais, desconto zero) para garantir robustez.""}, ""session_id"": ""6b043d0d-0b39-4ac0-bdb0-21c3c621466d"", ""error"": null, ""extra"": {""metadata"": {""LANGSMITH_ENDPOINT"": ""https://api.smith.langchain.com"", ""LANGSMITH_PROJECT"": ""bug-to-user-story"", ""LANGSMITH_TRACING"": ""true"", ""example_version"": ""2026-05-05T23:50:29.844149+00:00"", ""ls_example_dataset_split"": [""base""], ""ls_method"": ""traceable"", ""ls_run_depth"": 0, ""model"": ""gemini-2.5-flash"", ""num_repetitions"": 1, ""prompt_name"": ""msartor/bug_to_user_story_v2"", ""provider"": ""google"", ""revision_id"": null}, ""runtime"": {""langchain_core_version"": ""0.3.28"", ""langchain_version"": ""0.3.13"", ""library"": ""langsmith"", ""platform"": ""Linux-6.8.0-110-generic-x86_64-with-glibc2.39"", ""py_implementation"": ""CPython"", ""runtime"": ""python"", ""runtime_version"": ""3.12.2"", ""sdk"": ""langsmith-py"", ""sdk_version"": ""0.2.7""}}, ""run_type"": ""chain"", ""id"": ""7034f508-e41d-4f06-9534-a08e5f81909b"", ""status"": ""success""}",success,,10.140197992324829,5480,0.0029972,1.0,1.0,1.0
12ab0fa5-bb6b-4b68-af54-70f68a8d2f44,"{""bug_report"": ""Relatório de vendas demora mais de 2 minutos para gerar quando filtro ultrapassa 1000 registros.\n\nDetalhes:\n- Query SQL está sem index na coluna data_venda\n- Timeout do navegador após 120 segundos\n- Usuários reclamando de lentidão no horário comercial""}","{""reference"": ""Como um gerente de vendas, eu quero gerar relatórios de vendas rapidamente mesmo com grandes volumes de dados, para que eu possa analisar informações sem esperar longos períodos.\n\nCritérios de Aceitação:\n- Dado que solicito um relatório com mais de 1000 registros\n- Quando aplico filtros e clico em \""Gerar Relatório\""\n- Então o relatório deve ser gerado em menos de 30 segundos\n- E não deve ocorrer timeout no navegador\n- E o desempenho deve ser consistente em horário de pico\n\nContexto Técnico:\n- Problema identificado: falta de índice na coluna data_venda\n- Performance atual: >120s para 1000+ registros\n- Performance esperada: <30s para qualquer volume\n- Sugestão: adicionar índice e otimizar query SQL""}",msartor-bug_to_user_story_v2-548fe51e,1,"{""answer"": ""## User Story\n\n**Como** Gerente de Vendas,\n**Eu quero** gerar relatórios de vendas rapidamente, mesmo com um grande volume de dados,\n**Para que** eu possa tomar decisões estratégicas baseadas em dados atualizados e eficientes, sem interrupções ou frustrações.\n\n---\n\n## Critérios de Aceitação\n\n**Cenário 1: Geração rápida de relatório com volume de dados acima de 1000 registros**\n- **Dado que** sou um Gerente de Vendas\n- **E** o sistema possui mais de 1000 registros de vendas\n- **Quando** filtro o relatório de vendas por `data_venda` para um período que retorna mais de 1000 registros\n- **Então** o relatório deve ser gerado e exibido em no máximo 10 segundos\n- **E** não deve ocorrer timeout do navegador.\n\n**Cenário 2: Prevenção de timeout do navegador**\n- **Dado que** estou gerando um relatório de vendas com um filtro que retorna um grande volume de dados\n- **Quando** a geração do relatório é iniciada\n- **Então** o processo não deve exceder o limite de 120 segundos do navegador\n- **E** o relatório deve ser exibido com sucesso, sem mensagens de erro de timeout.\n\n**Cenário 3: Performance estável em horário de pico**\n- **Dado que** é horário comercial (ex: 09:00-17:00)\n- **E** múltiplos usuários estão gerando relatórios de vendas simultaneamente\n- **Quando** eu gero um relatório de vendas com mais de 1000 registros\n- **Então** o tempo de geração deve permanecer consistente e dentro do limite de 10 segundos\n- **E** não deve haver degradação significativa da performance do sistema.\n\n---\n\n## Contexto Técnico\n- **Causa raiz identificada**: Query SQL para geração de relatórios de vendas está sem índice na coluna `data_venda`.\n- **Sintoma**: Relatórios demoram mais de 2 minutos para gerar quando o filtro retorna mais de 1000 registros, resultando em timeout do navegador após 120 segundos.\n- **Solução proposta**: Adicionar índice na coluna `data_venda` da tabela de vendas para otimizar a performance da query.\n- **Melhorias adicionais a considerar**: Implementar paginação server-side para evitar carregar todos os dados de uma vez no front-end e, para volumes *muito* grandes (ex: >50.000 registros), considerar a geração assíncrona do relatório.\n- **Monitoramento**: Após a correção, monitorar o tempo de resposta da geração de relatórios com ferramentas de APM (Application Performance Monitoring) para garantir a estabilidade.\n\n## Notas Adicionais\n- **Prioridade**: Alta — Impacta diretamente a produtividade dos usuários e a capacidade de tomada de decisão no horário comercial.\n- **Impacto**: Frustração do usuário, perda de eficiência operacional.""}","{""inputs"": {""inputs"": {""bug_report"": ""Relatório de vendas demora mais de 2 minutos para gerar quando filtro ultrapassa 1000 registros.\n\nDetalhes:\n- Query SQL está sem index na coluna data_venda\n- Timeout do navegador após 120 segundos\n- Usuários reclamando de lentidão no horário comercial""}}, ""outputs"": {""answer"": ""## User Story\n\n**Como** Gerente de Vendas,\n**Eu quero** gerar relatórios de vendas rapidamente, mesmo com um grande volume de dados,\n**Para que** eu possa tomar decisões estratégicas baseadas em dados atualizados e eficientes, sem interrupções ou frustrações.\n\n---\n\n## Critérios de Aceitação\n\n**Cenário 1: Geração rápida de relatório com volume de dados acima de 1000 registros**\n- **Dado que** sou um Gerente de Vendas\n- **E** o sistema possui mais de 1000 registros de vendas\n- **Quando** filtro o relatório de vendas por `data_venda` para um período que retorna mais de 1000 registros\n- **Então** o relatório deve ser gerado e exibido em no máximo 10 segundos\n- **E** não deve ocorrer timeout do navegador.\n\n**Cenário 2: Prevenção de timeout do navegador**\n- **Dado que** estou gerando um relatório de vendas com um filtro que retorna um grande volume de dados\n- **Quando** a geração do relatório é iniciada\n- **Então** o processo não deve exceder o limite de 120 segundos do navegador\n- **E** o relatório deve ser exibido com sucesso, sem mensagens de erro de timeout.\n\n**Cenário 3: Performance estável em horário de pico**\n- **Dado que** é horário comercial (ex: 09:00-17:00)\n- **E** múltiplos usuários estão gerando relatórios de vendas simultaneamente\n- **Quando** eu gero um relatório de vendas com mais de 1000 registros\n- **Então** o tempo de geração deve permanecer consistente e dentro do limite de 10 segundos\n- **E** não deve haver degradação significativa da performance do sistema.\n\n---\n\n## Contexto Técnico\n- **Causa raiz identificada**: Query SQL para geração de relatórios de vendas está sem índice na coluna `data_venda`.\n- **Sintoma**: Relatórios demoram mais de 2 minutos para gerar quando o filtro retorna mais de 1000 registros, resultando em timeout do navegador após 120 segundos.\n- **Solução proposta**: Adicionar índice na coluna `data_venda` da tabela de vendas para otimizar a performance da query.\n- **Melhorias adicionais a considerar**: Implementar paginação server-side para evitar carregar todos os dados de uma vez no front-end e, para volumes *muito* grandes (ex: >50.000 registros), considerar a geração assíncrona do relatório.\n- **Monitoramento**: Após a correção, monitorar o tempo de resposta da geração de relatórios com ferramentas de APM (Application Performance Monitoring) para garantir a estabilidade.\n\n## Notas Adicionais\n- **Prioridade**: Alta — Impacta diretamente a produtividade dos usuários e a capacidade de tomada de decisão no horário comercial.\n- **Impacto**: Frustração do usuário, perda de eficiência operacional.""}, ""session_id"": ""6b043d0d-0b39-4ac0-bdb0-21c3c621466d"", ""error"": null, ""extra"": {""metadata"": {""LANGSMITH_ENDPOINT"": ""https://api.smith.langchain.com"", ""LANGSMITH_PROJECT"": ""bug-to-user-story"", ""LANGSMITH_TRACING"": ""true"", ""example_version"": ""2026-05-05T23:50:29.460083+00:00"", ""ls_example_dataset_split"": [""base""], ""ls_method"": ""traceable"", ""ls_run_depth"": 0, ""model"": ""gemini-2.5-flash"", ""num_repetitions"": 1, ""prompt_name"": ""msartor/bug_to_user_story_v2"", ""provider"": ""google"", ""revision_id"": null}, ""runtime"": {""langchain_core_version"": ""0.3.28"", ""langchain_version"": ""0.3.13"", ""library"": ""langsmith"", ""platform"": ""Linux-6.8.0-110-generic-x86_64-with-glibc2.39"", ""py_implementation"": ""CPython"", ""runtime"": ""python"", ""runtime_version"": ""3.12.2"", ""sdk"": ""langsmith-py"", ""sdk_version"": ""0.2.7""}}, ""run_type"": ""chain"", ""id"": ""45fa1ef6-c601-4738-8719-091d23cc40e7"", ""status"": ""success""}",success,,11.873687028884888,5780,0.0026206,0.98,1.0,1.0
1d9d396b-9ec7-4f2d-bcb4-a6cf4dfc0314,"{""bug_report"": ""Modal de confirmação de exclusão aparece atrás do menu lateral em telas pequenas (< 768px).\n\nDetalhes:\n- z-index do modal: 1000\n- z-index do menu lateral: 1050\n- Usuários não conseguem clicar nos botões do modal\n- Precisam fechar o menu lateral antes""}","{""reference"": ""Como um usuário em dispositivo móvel, eu quero que modais importantes apareçam acima de todos os outros elementos, para que eu possa interagir com eles sem precisar fechar outros componentes.\n\nCritérios de Aceitação:\n- Dado que estou em uma tela com largura menor que 768px\n- Quando aciono uma ação que abre um modal de confirmação\n- Então o modal deve aparecer acima de todos os elementos da página\n- E o menu lateral deve ficar desfocado (backdrop)\n- E todos os botões do modal devem ser clicáveis\n- E o modal deve ocupar pelo menos 90% da largura da tela\n\nCritérios de Acessibilidade:\n- O foco do teclado deve ir para o modal\n- Deve ser possível fechar com ESC\n- O backdrop deve fechar ao clicar fora\n\nContexto Técnico:\n- Bug atual: z-index modal (1000) < z-index menu (1050)\n- Solução: ajustar z-index do modal para > 1050\n- Devices afetados: mobile e tablets (< 768px)""}",msartor-bug_to_user_story_v2-548fe51e,1,"{""answer"": ""## User Story\n\n**Como** um usuário que precisa excluir um item,\n**Eu quero** que o modal de confirmação de exclusão apareça sempre visível e interativo,\n**Para que** eu possa confirmar ou cancelar a exclusão de forma rápida e sem precisar fechar outros elementos da interface.\n\n---\n\n## Critérios de Aceitação\n\n**Cenário 1: Modal de confirmação visível e interativo em telas pequenas**\n- **Dado que** estou em uma tela com largura menor que `768px` (ex: dispositivo móvel)\n- **E** o menu lateral está aberto e visível\n- **Quando** aciono a ação de exclusão que exibe um modal de confirmação\n- **Então** o modal de confirmação deve aparecer sobre o menu lateral\n- **E** o modal deve ser totalmente visível e interativo, permitindo o clique nos seus botões\n\n**Cenário 2: Interação bem-sucedida com os botões do modal**\n- **Dado que** estou em uma tela com largura menor que `768px`\n- **E** o menu lateral está aberto\n- **E** o modal de confirmação de exclusão está visível sobre o menu lateral\n- **Quando** clico nos botões \""Confirmar\"" ou \""Cancelar\"" dentro do modal\n- **Então** os botões devem responder ao clique\n- **E** a ação correspondente (exclusão ou cancelamento) deve ser executada sem a necessidade de fechar o menu lateral previamente\n\n**Cenário 3: Consistência do layout em diferentes tamanhos de tela**\n- **Dado que** aciono a ação de exclusão que exibe um modal de confirmação\n- **Quando** visualizo o modal em qualquer tamanho de tela (incluindo `< 768px` e `>= 768px`)\n- **Então** o modal deve sempre aparecer na frente de todos os outros elementos da interface (como menus, overlays, etc.)\n- **E** deve ser totalmente interativo em todas as condições\n\n---\n\n## Contexto Técnico\n- **Tipo de bug**: CSS / Layout / Z-index / Sobreposição.\n- **Causa raiz**: Conflito de `z-index` entre o modal de confirmação e o menu lateral.\n- **Valores atuais**:\n    - `z-index` do modal de confirmação: `1000`\n    - `z-index` do menu lateral: `1050`\n- **Condição de falha**: Ocorre em telas com largura menor que `768px`.\n- **Solução proposta**: Aumentar o `z-index` do modal de confirmação para um valor superior ao do menu lateral (ex: `1051` ou mais).\n- **Impacto**: Usuários não conseguem interagir com o modal em telas pequenas, sendo forçados a fechar o menu lateral manualmente antes de confirmar ou cancelar a exclusão.\n- **Recomendação adicional**: Revisar a hierarquia de `z-index` em toda a aplicação para evitar futuros conflitos e garantir a correta sobreposição de elementos.\n\n## Notas Adicionais\n- **Prioridade**: Média — afeta a usabilidade e a conclusão de tarefas importantes em dispositivos móveis.\n- **Sugestão de implementação**: Testar a correção em diferentes navegadores e dispositivos móveis para garantir a consistência.""}","{""inputs"": {""inputs"": {""bug_report"": ""Modal de confirmação de exclusão aparece atrás do menu lateral em telas pequenas (< 768px).\n\nDetalhes:\n- z-index do modal: 1000\n- z-index do menu lateral: 1050\n- Usuários não conseguem clicar nos botões do modal\n- Precisam fechar o menu lateral antes""}}, ""outputs"": {""answer"": ""## User Story\n\n**Como** um usuário que precisa excluir um item,\n**Eu quero** que o modal de confirmação de exclusão apareça sempre visível e interativo,\n**Para que** eu possa confirmar ou cancelar a exclusão de forma rápida e sem precisar fechar outros elementos da interface.\n\n---\n\n## Critérios de Aceitação\n\n**Cenário 1: Modal de confirmação visível e interativo em telas pequenas**\n- **Dado que** estou em uma tela com largura menor que `768px` (ex: dispositivo móvel)\n- **E** o menu lateral está aberto e visível\n- **Quando** aciono a ação de exclusão que exibe um modal de confirmação\n- **Então** o modal de confirmação deve aparecer sobre o menu lateral\n- **E** o modal deve ser totalmente visível e interativo, permitindo o clique nos seus botões\n\n**Cenário 2: Interação bem-sucedida com os botões do modal**\n- **Dado que** estou em uma tela com largura menor que `768px`\n- **E** o menu lateral está aberto\n- **E** o modal de confirmação de exclusão está visível sobre o menu lateral\n- **Quando** clico nos botões \""Confirmar\"" ou \""Cancelar\"" dentro do modal\n- **Então** os botões devem responder ao clique\n- **E** a ação correspondente (exclusão ou cancelamento) deve ser executada sem a necessidade de fechar o menu lateral previamente\n\n**Cenário 3: Consistência do layout em diferentes tamanhos de tela**\n- **Dado que** aciono a ação de exclusão que exibe um modal de confirmação\n- **Quando** visualizo o modal em qualquer tamanho de tela (incluindo `< 768px` e `>= 768px`)\n- **Então** o modal deve sempre aparecer na frente de todos os outros elementos da interface (como menus, overlays, etc.)\n- **E** deve ser totalmente interativo em todas as condições\n\n---\n\n## Contexto Técnico\n- **Tipo de bug**: CSS / Layout / Z-index / Sobreposição.\n- **Causa raiz**: Conflito de `z-index` entre o modal de confirmação e o menu lateral.\n- **Valores atuais**:\n    - `z-index` do modal de confirmação: `1000`\n    - `z-index` do menu lateral: `1050`\n- **Condição de falha**: Ocorre em telas com largura menor que `768px`.\n- **Solução proposta**: Aumentar o `z-index` do modal de confirmação para um valor superior ao do menu lateral (ex: `1051` ou mais).\n- **Impacto**: Usuários não conseguem interagir com o modal em telas pequenas, sendo forçados a fechar o menu lateral manualmente antes de confirmar ou cancelar a exclusão.\n- **Recomendação adicional**: Revisar a hierarquia de `z-index` em toda a aplicação para evitar futuros conflitos e garantir a correta sobreposição de elementos.\n\n## Notas Adicionais\n- **Prioridade**: Média — afeta a usabilidade e a conclusão de tarefas importantes em dispositivos móveis.\n- **Sugestão de implementação**: Testar a correção em diferentes navegadores e dispositivos móveis para garantir a consistência.""}, ""session_id"": ""6b043d0d-0b39-4ac0-bdb0-21c3c621466d"", ""error"": null, ""extra"": {""metadata"": {""LANGSMITH_ENDPOINT"": ""https://api.smith.langchain.com"", ""LANGSMITH_PROJECT"": ""bug-to-user-story"", ""LANGSMITH_TRACING"": ""true"", ""example_version"": ""2026-05-05T23:50:30.419736+00:00"", ""ls_example_dataset_split"": [""base""], ""ls_method"": ""traceable"", ""ls_run_depth"": 0, ""model"": ""gemini-2.5-flash"", ""num_repetitions"": 1, ""prompt_name"": ""msartor/bug_to_user_story_v2"", ""provider"": ""google"", ""revision_id"": null}, ""runtime"": {""langchain_core_version"": ""0.3.28"", ""langchain_version"": ""0.3.13"", ""library"": ""langsmith"", ""platform"": ""Linux-6.8.0-110-generic-x86_64-with-glibc2.39"", ""py_implementation"": ""CPython"", ""runtime"": ""python"", ""runtime_version"": ""3.12.2"", ""sdk"": ""langsmith-py"", ""sdk_version"": ""0.2.7""}}, ""run_type"": ""chain"", ""id"": ""f30ed783-83ca-4db5-b7a6-76748d48191b"", ""status"": ""success""}",success,,10.394227027893066,5544,0.002827,0.98,0.75,1.0
